<?xml version="1.0" encoding="UTF-8"?>
<xsd:schema xmlns:xsd="http://www.w3.org/2001/XMLSchema" elementFormDefault="qualified">
    <xsd:element name="users" type="usersType"/>
    <xsd:complexType name="usersType">
        <xsd:sequence maxOccurs="unbounded">
            <xsd:element name="user" type="userType"/>
        </xsd:sequence>
    </xsd:complexType>
    <xsd:complexType name="userType">
        <xsd:sequence>
        	<xsd:element name="first-name" type="xsd:string"/>
        	<xsd:element name="last-name" type="xsd:string"/>
            <xsd:element name="username" type="xsd:string"/>
            <xsd:element name="password" type="xsd:string"/>
        </xsd:sequence>
    </xsd:complexType>
</xsd:schema>